,author,date,zone,problems,bottom_line,discussion
11,Cam Johnson,2024-03-06,Flathead Range & Glacier NP,"[{'problem_type': ' Persistent Slab', 'problem_number': 1, 'likelihood': 'possible', 'size': ['Large (D2)', '', 'Very Large (D3)'], 'aspect_elevation': {'upper': ['north', 'northeast', 'east', 'southeast', 'northwest'], 'middle': ['north', 'northeast', 'east', 'southeast', 'northwest'], 'lower': []}, 'discussion': 'A weak layer of facets near the early February Crust is the culprit of many large natural and human-triggered avalanches in the last few weeks. Exercise caution on shaded slopes near and above 6500 feet in elevation. If triggered, slabs can break 2 to 4 feet deep and will be difficult to escape. The most conservative option is to stick to lower-angled slopes in areas where the problem exists. Avoid steep rollovers and rocky outcroppings if you choose to enter steeper terrain on shaded slopes.\xa0'}, {'problem_type': ' Wind Slab', 'problem_number': 2, 'likelihood': 'possible', 'size': ['Small (D1)', '', 'Large (D2)'], 'aspect_elevation': {'upper': ['north', 'northeast', 'east', 'southeast', 'northwest'], 'middle': ['north', 'northeast', 'east', 'southeast', 'northwest'], 'lower': []}, 'discussion': 'Winds transported snow into fresh slabs on leeward-facing aspects. Wind slabs range from thin to thick and new to old. The more sensitive of the two will be thin slabs that formed in the last 24 hours. Drifted snow should be easy to identify by its dune shape or textured appearance. Wind Slabs formed on slopes that harbor weak layers buried deep in the snowpack. It is possible that triggering a small Wind Slab could step down to a dangerous Persistent Slab avalanche. Avoid this problem by sticking to slopes less than 30 degrees, or by choosing aspects that face south or west.'}]","The primary concern is avalanches failing 2 to 4 feet deep on a persistent weak layer. Winds drifted snow into thicker, denser slabs above 5000 feet. Manage both problems by selecting lower-angled slopes on aspects that face NW-N-NE-SE.
Expect a Wet Loose avalanche problem IF the sun stays out longer than anticipated. Rollerballs and gloppy snow are signs of an impending Wet Loose avalanche cycle. Move to shaded slopes if you see this beginning. ","Avalanche activity in the last week has ranged from small to large (D1-D2), with a few very large (D3) avalanches. Most reported avalanches were Storm/Wind Slabs on slopes above 5000 feet. The larger avalanches are Persistent Slab avalanches failing 2 to 4 feet deep on a layer of facets above a hard crust buried in early February. Avalanche activity on this layer is most common above 6500 feet on aspects that face N-NE-SE.
Instabilities in the new and drifted snow should be relatively short-lived. Winds were transporting snow yesterday. Expect to see signs of cracking with the possibility of triggering smaller slabs on leeward-facing aspects. These new thin slabs rest over thick, hard slabs from the past week of moderate to strong winds. Although those are gaining strength, I’d still be wary of jumping onto steep slopes that face NW-NE-SE.
Persistent weak layers buried near the early February Crust remain untrustworthy. Snowpit tests continue to show mixed results of propagating and non-propagating. In some areas, this layer is buried at a depth where a human is less likely to trigger. On the flip side, if triggered, the resulting avalanche may be unsurvivable. Common trigger points are convex rollovers and thin parts of the slab. Unfortunately, it is sometimes impossible to identify where those thin parts are. Rocky outcroppings or areas scoured by the wind are the usual suspects.
The weather forecast suggests periods of clear skies. IF the sun stays out for longer than anticipated, or if you travel to the Whitefish Range which is supposed to see fewer clouds, then expect a loose snow avalanche problem on aspects getting hit by the warm sun. Sluffs, rollerballs, and gloppy snow are signs of a Wet Loose avalanche problem. Move to lower-angle slopes or slopes shaded by the sun if you see this problem beginning. 
 "
12,blase reardon,2024-03-05,Flathead Range & Glacier NP,"[{'problem_type': ' Wind Slab', 'problem_number': 3, 'likelihood': 'possible', 'size': ['Small (D1)', '', 'Large (D2)'], 'aspect_elevation': {'upper': ['north', 'northeast', 'east', 'southeast', 'northwest'], 'middle': ['north', 'northeast', 'east', 'southeast', 'northwest'], 'lower': []}, 'discussion': 'Today\'s third hazard lies in between the other two - apparent if you\'re looking, with the potential to bury or injure a person. The region has seen bouts of moderate to strong winds the past week that have built multiple generations of wind slabs. If winds pick up today as forecast, we may see another, as the low-density snow from Monday gets drifted. Patches of dense but soft snow near ridges will be the most sensitive to the weight of a person or snow machine. They may be covering older hard slabs of wind-packed snow that are harder for a person to trigger, but produce larger, more dangerous avalanches. These can step down and release very dangerous avalanches that break on the weak facets above the crust.\xa0 Look for dunes, drifts, and whale-shaped piles of hard snow below ridge crests and on the downwind sides of terrain features of rocks and gully walls. More subtle are drifts cross-loaded onto steep slopes, as shown by this unintentionally-triggered slide Monday east of Whitefish Mountain Resort. Hard, hollow-feeling snow isn\'t ""bomber,"" it\'s a slab.\xa0'}, {'problem_type': ' Persistent Slab', 'problem_number': 1, 'likelihood': 'possible', 'size': ['Large (D2)', '', 'Very Large (D3)'], 'aspect_elevation': {'upper': ['north', 'northeast', 'east', 'southeast', 'northwest'], 'middle': ['north', 'northeast', 'east', 'southeast', 'northwest'], 'lower': []}, 'discussion': ""The most serious hazard today is the one to account for when choosing destinations, routes, and places to play. The lowest risk choices don't require travel under steep, shady start zones or riding up or down convex slopes where snow depths are likely to be variable. The potential for triggering avalanches from below lingers, and thin spots in the snow cover are potential trigger points for releasing hard slabs that would be very difficult to escape. A thin layer of weak, faceted snow is buried 2 to 4 feet deep, a few inches above a stout ice layer and/ or melt-freeze crust. While this layer is subtle in snowpits, the avalanches releasing on it are anything but. Multiple large to very large avalanches failed on this layer during the end of February storm and avalanche cycle. Many occurred on very steep, leeward slopes below ridges, where wind-transported snow built thicker, harder slabs over the facets. This upper elevation terrain remains the place where you're most likely to trigger an avalanche on the faceted layer.\xa0 At mid elevations, we've had almost no reports of avalanches, whumpfing collapses, or snowpit tests that show instability in the past week. However, fatal avalanche accidents to the west and north of our region likely involved this layer and occurred near 6500 feet, the boundary between our mid and upper elevations. That tells me that it's important to minimize exposure to this hazard in terrain approaching that elevation, to leave a margin for safety.\xa0 So pick destinations that offer options to ride sunny slopes where the weak layer is less common, especially because the riding on these slopes will deteriorate with the sun and warming temperatures headed our way. In shady terrain, stick to lower angled slopes that are planar or concave in profile. Park or stop well out of the runouts of steep start zones, even on what look like small slopes.\xa0 \xa0""}, {'problem_type': ' Dry Loose', 'problem_number': 2, 'likelihood': 'possible', 'size': ['Small (D1)', '', 'Large (D2)'], 'aspect_elevation': {'upper': ['southeast', 'south', 'southwest', 'west'], 'middle': ['southeast', 'south', 'southwest', 'west'], 'lower': []}, 'discussion': ""The most obvious hazard today will be the easiest to avoid. If the sun comes out this afternoon, expect sluffs of fresh snow to run on very steep slopes, triggered by snow falling off trees or rocks. Most will be harmless. The exceptions will be: If you're in or below this terrain and you see rollerballs fanning downslope, move on. If you want to ride steep, confined slopes, get down and out from under them before the sun hits.""}]","Choose your destinations and play spots with an eye to avoiding today's trifecta of avalanche hazards. The most serious is triggering large, serious avalanches that break on weak snow buried 2 to 4 feet deep. Secondary hazards today include the potential for sluffing in the new snow, particularly if the sun comes out, and the possibility of triggering dense slabs of drifted snow. Careful attention to terrain will help you find a Goldilocks band of quality, low-risk riding.","Problems, problems, problems. We've listed three avalanche hazards today. Recent obs describe a rain crust that extends to about 5000 feet and sometimes 5300 feet. Others, a sun crust on solar aspects, particularly southwest.
The Goldilocks band is above that rain crust, in shaded, wind-sheltered terrain that's not too steep and free of the lingering danger of triggering slides that break deep in the snowpack. Whew. It's half-caff semi-dry cappucino with oat milk. But being specific is the key to low risk, fun riding today. Check the problem descriptions for ideas how to maximize your your riding and safety today.
The general trend is decreasing danger, as weak layers slowly strengthen and adjust to the load delivered by this past weekend's storm. A ridge building in at the end of this week will interrupt that trend on sunny slopes. Clear skies and direct sun may produce a wet snow avalanche cycle on sunny slopes. Shaded slopes, however, will continue to stabilize so long as temperatures remain below freezing overnight. It's hard to say yet whether the ridge will bring a diurnal melt-freeze cycle strong enough to produce supportable crusts and corn on sunny slopes early in the day. Stay tuned. "
13,Sarah Williams,2024-03-04,Flathead Range & Glacier NP,"[{'problem_type': ' Persistent Slab', 'problem_number': 1, 'likelihood': 'possible', 'size': ['Large (D2)', '', 'Very Large (D3)'], 'aspect_elevation': {'upper': ['north', 'northeast', 'east', 'southeast', 'northwest'], 'middle': ['north', 'northeast', 'east', 'southeast', 'northwest'], 'lower': []}, 'discussion': ""A layer of weak, faceted snow buried 2-4 feet was the failure layer in multiple large avalanches during Wednesday and Thursday's snowfall and intense wind events. This layer is several inches above the hard, early February ice and crust on shady, mid- and upper-elevation slopes. This weak snow has been challenging to identify in snowpits and does not always produce concerning results in stability tests.\xa0 This week's cool temperatures will slow the strengthening of this weak layer. You may not experience any signs of instability like collapsing or cracking before triggering a slide.\xa0 Choose terrain free of convexities to increase your safety margin. Steer around thin areas, such as those scoured or peppered with rocks, in favor of a deeper, more consistent snowpack. Cracking beneath your boards or machine indicates an unstable slab, and a sign to move to lower-angle terrain.\xa0""}, {'problem_type': ' Wind Slab', 'problem_number': 2, 'likelihood': 'possible', 'size': ['Small (D1)', '', 'Large (D2)'], 'aspect_elevation': {'upper': ['north', 'northeast', 'east', 'southeast', 'northwest'], 'middle': [], 'lower': []}, 'discussion': ""This problem consists of two distinct generations of wind-drifted snow. The older slabs formed during Wednesday and Thursday's strong to extreme southwest winds. It consists of hard slabs that may be several feet thick. These features may be masked by recent snowfall, sound hollow like a drum, support you and your machine, and offer no signs of instability until they fail. You are more likely to trigger them from thinner spots in the slabs. Triggering a hard slab avalanche poses the risk of the slide stepping down to a deeper buried weak layer. More recent slabs formed over the weekend in the new snow. These should be easier to identify by soft, fresh drifts, dunes, rippled snow surfaces, and snow pillows. You may notice cracking beneath your boards or machine, indicating you have found an unstable slab. Let this direct you to lower-angle terrain.\xa0 Today's snowfall will replenish fetches and be available for transport, especially above 6,500 feet. Blowing snow and cornices point in the direction of danger.""}]","Buried weak layers remain a concern. If triggered, these avalanches are likely very large and unsurvivable. Keep in mind that as you gain elevation, ridgetop terrain is affected by winds and may be reactive to the weight of your sled or boards.","Reports of natural avalanches have continued to come in from the past week. Many of these avalanches are large to very large and have the characteristics of a persistent slab problem. Crowns and fracture lines are several feet thick; many of these slides are more than 100 feet wide. These slides likely failed during the intense wind-loading event on Wednesday night or Thursday morning. They likely failed on a layer of weak faceted snow above the early February crust. We expect to continue to catalog similar avalanches when we have clearing skies and visibility. 
Incremental snow accumulations and light winds are expected today. As many observers reported on Sunday, there have been few signs of instability during their tours. Two observers in the northern Whitefish Range had no propagating results in their snowpack tests but were alarmed to see a large avalanche with a crown of 3 feet (Red Meadow observation, Link observation). In the Flathead Range, multiple crowns of very large avalanches have been observed (photo 1, photo 2, photo 3), with all of these slides starting at upper elevations.
Observers completing a snow survey in Glacier National Park submitted photos of debris that impacted the Going-To-the-Sun-Road from the Red Rock Slide path (photo 1, photo 2). The debris appears to be wet loose from the Leap Day rain event. Red Rock is just upstream from Avalanche Creek and is a dramatic path that drops steeply for 3484 feet off the shoulder of Mt Cannon (photo). This path hits the road yearly and occasionally dams up the adjacent McDonald Creek."
14,Mark Dundas,2024-03-03,Flathead Range & Glacier NP,"[{'problem_type': ' Persistent Slab', 'problem_number': 2, 'likelihood': 'possible', 'size': ['Large (D2)', '', 'Very Large (D3)'], 'aspect_elevation': {'upper': ['north', 'northeast', 'east', 'southeast', 'northwest'], 'middle': ['north', 'northeast', 'east', 'southeast', 'northwest'], 'lower': []}, 'discussion': ""During Wednesday and Thursday's snowfall and intense wind events, a layer of weak, faceted snow buried 2-4 feet was the failure layer in multiple large avalanches. This layer is several inches above the hard, early February ice and crust on shady, mid- and upper-elevation slopes. This weak snow has been challenging to identify in snowpits\xa0and does not always produce concerning results in\xa0stability tests.\xa0 This week's cool temperatures will slow the strengthening of this weak layer. You may not experience any signs of instability like collapsing or cracking before triggering a slide.\xa0 Choose terrain free of convexities to increase your safety margin. Steer around thin areas, such as those scoured or peppered with rocks, in favor of a deeper, more consistent snowpack. Cracking beneath your boards or machine indicates an unstable slab directing you to lower-angle terrain.\xa0""}, {'problem_type': ' Wind Slab', 'problem_number': 1, 'likelihood': 'possible', 'size': ['Small (D1)', '', 'Large (D2)'], 'aspect_elevation': {'upper': ['north', 'northeast', 'east', 'southeast', 'northwest'], 'middle': ['north', 'northeast', 'east', 'southeast', 'northwest'], 'lower': []}, 'discussion': ""Wednesday and Thursday's gale-force southwest winds drifted substantial snow into thick, hard slabs. A wind shift to a north and east direction Friday and Saturday may have built thin slabs in locations favored by atypical winds. A return to southwesterly flow is transporting Saturday's low-density snowfall.\xa0 Recently formed hard slabs may be masked by yesterday's snow. They may sound hollow like a drum, support you and your machine, and offer no signs of instability until they fail. Features formed over the past 48 hours should provide more straightforward clues, such as drifts, dunes, rippled snow surfaces, and snow pillows. Cracks shooting away from you indicate you have found an unstable slab directing you to sheltered or lower-angle terrain.\xa0 On Saturday, riders in the Whitefish Range found thin reactive slabs in sheltered locations. This instability probably formed due to intense precipitation intensity and should be short-lived. However, look for slopes holding cohesive snow in the trees.\xa0 Saturday's low-density snow may sluff on steep slopes in sheltered locations, primarily where this snow rests on a slick recently formed rain crust or a thick layer of cohesionless powder.\xa0 \xa0""}]","Recently formed hard slabs may be masked by yesterday's snow. You're most likely to trigger a slide in terrain that the wind has loaded. You can reduce your risk of triggering slides today by avoiding steep, rocky, wind-affected slopes.","Most locations experienced a brief, intense shot of precipitation Saturday. Widespread snow totals are generally 3-6 inches, with the northern Whitefish Range and the Flathead Range favored and the Swan Range a distant third.  Fortunately, temperatures have cooled since last week's valley floor 50F readings, with the snow line now below 1000 feet. Cold arctic air is spilling over the Continental Divide on the far eastern edge of our advisory area with -3F at Marias Pass this morning. 
Saturday, experienced backcountry groups found enjoyable riding in sheltered locations. A party in the northern Whitefish Range experienced up to 16 inches of dry, unconsolidated snow with no instabilities observed. A group in the southern Whitefish Range found the new storm snow touchy and noted multiple (10+) thin D1-size slabs in sheltered locations. They wisely maintained wide margins, only exposed themselves to nonconsequential terrain, and intentionally stuck to low-angle and low-consequence slopes throughout the tour. A group in the Flathead Range noted calm conditions in a drainage sheltered from the east winds. They had 3 inches of afternoon snowfall with some sluffing in the new snow, and 5300 feet seems to be the transition point from good skiing to more spicy.
FAC staff traveled to Cascadilla Creek to look closer at a very large avalanche on Nyack Mountain. Unfortunately, our visibility window was limited to a short period when we were still well down the valley from the slide. However, we did get enough of a view in the flat light to recognize this slide is very large, with a crown exceeding 1000 feet wide. This slide failed during the intense wind-loading event on Wednesday night or Thursday morning. It likely failed on a layer of weak faceted snow above the early February crust. We did note that rain had affected the low and middle elevations of this drainage, leaving behind a widespread surface crust (photo) and well-developed runnels (photo), which made skiing challenging. 
 "
15,Rob Millspaugh,2024-03-02,Flathead Range & Glacier NP,"[{'problem_type': ' Persistent Slab', 'problem_number': 2, 'likelihood': 'possible', 'size': ['Large (D2)', '', 'Very Large (D3)'], 'aspect_elevation': {'upper': ['north', 'northeast', 'east', 'southeast', 'northwest'], 'middle': ['north', 'northeast', 'east', 'southeast', 'northwest'], 'lower': []}, 'discussion': ""Slides can break 2-4 feet deep on a layer of weak, faceted snow in steep, shaded terrain at upper and middle elevations. This layer is found several inches above a stout crust formed in early February. It has been difficult to identify in snowpits and does not always produce concerning results in stability tests. This week, snow and strong winds overloaded buried weak layers, resulting in large destructive avalanches, most notably in the Flathead Range and southern Glacier Park. Natural avalanches ran on this layer Thursday in John F. Stevens Canyon. Human-triggered avalanches during the President's\xa0 Day weekend resulted in several accidents and near-misses in the Marion Lake area. The structure has been reported across the region and was the cause of a fatality in the Canadian reaches of the North Fork of the Flathead River on Feb. 24. \xa0Slabs can break well above you, wrap around terrain features, and will be difficult, if not impossible, to escape. They can also be triggered remotely or sympathetically from below or adjacent slopes.\xa0""}, {'problem_type': ' Wind Slab', 'problem_number': 1, 'likelihood': 'possible', 'size': ['Small (D1)', '', 'Large (D2)', '', 'Very Large (D3)'], 'aspect_elevation': {'upper': ['north', 'northeast', 'east', 'southeast', 'northwest'], 'middle': ['north', 'northeast', 'east', 'southeast', 'northwest'], 'lower': []}, 'discussion': ""Today, winds could shift to easterly and transport new and recent snow onto atypical slopes. This could result in thin and sensitive drifts on slopes that are usually sheltered or windward.\xa0 These slabs should remain small and relatively harmless. Consider moving to lower-angle terrain if today's snowfall overproduces and you find 8 or more inches of new or wind-drifted snow. During the previous 5 days, moderate to strong southwesterly winds drifted snow onto leeward slopes along ridgelines and cross-loaded gullies.\xa0 Winds peaked Thursday afternoon and have been tapering off since. Slabs range from soft to hard. Soft slabs may crack around your feet or machine to warn you of their instability.\xa0 Hard slabs will not do this until it's too late. For the best and safest riding, seek out sheltered slopes. Scalloped snow surfaces and dune-shaped drifts are visual indicators of wind-affected snow. However, today's snowfall may cover these features and make it more difficult to identify wind slabs. If your skis, board, or machine start to ride on top of a stiff, hollow-sounding surface, you've likely found a wind slab. Remember that even a small slide can step down to a deeper weak layer, resulting in a larger, more destructive avalanche, as described in the Persistent Slab problem below.""}]","Recent wind and snow have stressed weak layers buried deep in the snowpack. Decrease your risk by limiting travel on and below steep, wind-drifted slopes. Avalanches can break well above you, wider than expected, and will be difficult to escape.
 ","The snow surface took a beating this week from moderate to strong southwesterly winds. Yesterday (Friday), Blase and Sarah were East of WMR, where they noted improved weather and stability but generally worse riding conditions than the previous day’s. Although the winds have relented, and natural avalanche activity is unlikely today, it is still possible for a rider to trigger a deadly avalanche, particularly on upper-elevation leeward slopes.  
North of the advisory area, a Special Public Avalanche Warning is in effect for most of British Columbia’s and Alberta’s forecast regions. This warning concerns recent loading on “prominent weak layers established during drought conditions in February.” That should sound familiar since a similar structure has been found across our region.
We received less snow than our neighbors to the north, but we had plenty of wind to make up for it. Thursday, BNSF Avalanche Safety reported a handful of large to very large natural avalanches in John F Stevens Canyon. These slides likely ran sometime late on Wednesday, occurred on wind-loaded slopes, and several may have failed on buried weak layers. Friday, we received similar reports of several very large avalanches in the Middle Fork drainages. These recent slides indicate that the persistent weak layer has not fully healed and still demands caution."
