,author,date,zone,problems,bottom_line,discussion
0,Mark Dundas,2024-03-17,Flathead Range & Glacier NP,"[{'problem_type': ' Persistent Slab', 'problem_number': 1, 'likelihood': 'possible', 'size': ['Large (D2)', '', 'Very Large (D3)'], 'aspect_elevation': {'upper': ['north', 'northeast', 'east', 'southeast', 'northwest'], 'middle': ['north', 'northeast', 'east', 'southeast', 'northwest'], 'lower': []}, 'discussion': 'Avoid traveling in avalanche terrain today. The likelihood of spontaneous large and very large avalanches makes steep terrain and avalanche runouts very dangerous. Heat and radiation are destabilizing hard slabs perched on deeply buried weak layers. These layers are widespread but variable in strength, making it impossible to determine which slopes will fail and when they will fail.  Multiple large hard slab avalanches occurred Friday and Saturday in Glacier Park and the Flathead Range and likely failed on buried weak layers above an early February crust. Debris from these slides can run the full length of avalanche paths, making surviving one of these events nearly impossible.\xa0 \xa0'}, {'problem_type': ' Cornice Fall', 'problem_number': 3, 'likelihood': 'likely', 'size': ['Small (D1)', '', 'Large (D2)'], 'aspect_elevation': {'upper': ['north', 'northeast', 'east', 'southeast', 'northwest'], 'middle': ['north', 'northeast', 'east', 'southeast', 'northwest'], 'lower': []}, 'discussion': 'Impressive southwest winds built large cornices along alpine ridgelines in late February/early March. Intense warming this weekend may weaken these features. A failing cornice can send large blocks of snow trundling downhill, potentially triggering a destructive avalanche.\xa0 The nature of this problem is highly unpredictable and should warrant your respect. Give these whales a wide berth above and below a corniced ridgeline to reduce your risk. Don’t get surprised by a cornice breaking further back than expected. '}, {'problem_type': ' Wet Loose', 'problem_number': 2, 'likelihood': 'very likely', 'size': ['Small (D1)', '', 'Large (D2)'], 'aspect_elevation': {'upper': ['north', 'northeast', 'east', 'southeast', 'south', 'southwest', 'west', 'northwest'], 'middle': ['north', 'northeast', 'east', 'southeast', 'south', 'southwest', 'west', 'northwest'], 'lower': ['north', 'northeast', 'east', 'southeast', 'south', 'southwest', 'west', 'northwest']}, 'discussion': 'Today will be unseasonably warm, leading to another day of wet snow instabilities. Over the past three days, rollerballs and loose snow slides have occurred on sunny aspects. This problem has expanded to include the northern aspects, where previously dry snow is becoming wet.\xa0 Mushy snow that does not support your weight or machine is a sign you could trigger a loose slide. Although the debris is relatively small, these slides can pack a punch in chutes or gullies, where escape may be difficult. Be aware of the terrain above you and where an avalanche could carry you.\xa0 These small avalanches can trigger\xa0a much larger\xa0avalanche\xa0lower on the slope. Continued warm temperatures combined with a poor overnight freeze allow meltwater to drain to weak layers deeper in the snowpack, making wet slab avalanches possible.\xa0'}]",An Avalanche Warning is in effect in all zones of our advisory area. Very dangerous avalanche conditions exist today and will likely continue during a period of prolonged warming. Avoid traveling in avalanche terrain today.,"We are continuing an Avalanche Warning for the Swan Range, the Whitefish Range, the Flathead Range, and portions of Glacier National Park through 0600 tomorrow (Monday). If conditions dictate, we may extend this warning to Tuesday. As of Sunday mid-morning, temperatures at many mid- and upper-elevation stations had been above freezing for 48 hours, reaching 50F at two upper-elevation stations yesterday.
The abnormally warm temperatures triggered deep hard slab avalanches on shaded slopes and thinner slabs on sunny aspects. Friday, the BNSF Avalanche Safety Team reported 3 large slab avalanches observed from Highway 2. Cam observed a D2.5 hard slab avalanche on a northwest aspect of Great Northern, and outside our forecast region, Rob viewed several large slab avalanches on sunny aspects of the Swan Crest near Condon. Saturday, blase observed multiple slab avalanches in the eastern portion of the advisory area, while Rob and I noted slides in the mountains around Lake McDonald. WMR patrol closed all their avalanche terrain as the day warmed. 
Our multi-day warming raises the risk of wet slab avalanches. Melting surface snow produces water that drains into the snowpack and may eventually reach the ground unless an impediment like a thick crust or weak layer is encountered. Here, the meltwater pools and increases the chance of releasing a wet slab avalanche. The meltwater production occurs faster on sunny slopes, where there are more crusts to interrupt the draining process. The general rule of thumb regarding this process is that three nights without a freeze are needed for meltwater production to drain into the snowpack. If forecasted temperatures materialize, we may begin seeing wet slab activity in the next day or two, although timing these is difficult. 
Planning an early exit and choosing low-angle terrain free of overhead hazards are ways to manage your risk in the face of uncertainty. If you observe avalanche activity, submit an observation to let us know what you are seeing. "
1,Sarah Williams,2024-03-16,Flathead Range & Glacier NP,"[{'problem_type': ' Persistent Slab', 'problem_number': 1, 'likelihood': 'possible', 'size': ['Large (D2)', '', 'Very Large (D3)'], 'aspect_elevation': {'upper': ['north', 'northeast', 'east', 'southeast', 'northwest'], 'middle': ['north', 'northeast', 'east', 'southeast', 'northwest'], 'lower': []}, 'discussion': 'Avoid traveling in avalanche terrain today. The likelihood of spontaneous large and very large avalanches makes steep terrain and avalanche runouts very dangerous today. Heat and radiation are destabilizing hard slabs perched on deeply buried weak layers. These layers are widespread but variable in strength, making it difficult to impossible to determine which slopes will fail and when. Debris from these slides can run the full length of avalanche paths. You are unlikely to survive getting hit by one of these beasts. The usual tests and terrain management practices are woefully inadequate in these conditions.'}, {'problem_type': ' Cornice Fall', 'problem_number': 3, 'likelihood': 'likely', 'size': ['Small (D1)', '', 'Large (D2)'], 'aspect_elevation': {'upper': ['north', 'northeast', 'east', 'southeast', 'northwest'], 'middle': ['north', 'northeast', 'east', 'southeast', 'northwest'], 'lower': []}, 'discussion': 'Impressive southwest winds built large cornices along alpine ridgelines in late February/early March. Intense warming this weekend is weakening these features. A failing cornice can send large blocks of snow trundling downhill. These can be dangerous in themselves. They can also trigger destructive avalanches that fail on deeply buried weak layers.\xa0 The nature of this problem is highly unpredictable and should warrant your respect. Give these whales a wide berth above and below a corniced ridgeline to reduce your risk. Don’t get surprised by a cornice breaking further back than expected. '}, {'problem_type': ' Wet Loose', 'problem_number': 2, 'likelihood': 'very likely', 'size': ['Small (D1)', '', 'Large (D2)', '', 'Very Large (D3)'], 'aspect_elevation': {'upper': ['north', 'northeast', 'east', 'southeast', 'south', 'southwest', 'west', 'northwest'], 'middle': ['north', 'northeast', 'east', 'southeast', 'south', 'southwest', 'west', 'northwest'], 'lower': ['north', 'northeast', 'east', 'southeast', 'south', 'southwest', 'west', 'northwest']}, 'discussion': 'Overnight temperatures stayed above freezing at many mid- and upper-elevation stations, and today’s temperatures will climb higher than the past few days. Wet snow avalanche hazards will become more widespread and destructive, and they may include shaded aspects that have previously held dry snow.\xa0 Pinwheels or rollerballs indicate the snow surface is softening, and loose snow avalanches may soon follow. Avoid exposing yourself to this problem in terrain with overhead hazards. Avoid traveling above terrain traps, where debris can pile up deep, and in long-running gullies, where escape may be difficult.'}]","An Avalanche Warning is in effect in all zones of our advisory area. Very dangerous avalanche conditions exist today, and will likely continue during a period of prolonged warming. Avoid traveling in avalanche terrain today.","Ready or not, the heat is on for this weekend. We have issued an Avalanche Warning for the Swan Range, the Whitefish Range, the Flathead Range, and parts of Glacier National Park from 6 am today through 6 am tomorrow (Sunday). Remote weather stations have recorded above-freezing temperatures since yesterday, creating a lack of refreezing overnight. Heat and radiation destabilize thick, hard slabs, weaken cornices, and create widespread areas of wet surface snow.
We are most concerned about hard slab avalanches failing on buried weak layers. This Persistent Slab problem is unpredictable, and the consequences of getting caught in this type of slide are deadly. Observations from yesterday (Friday) included the BNSF Avalanche Safety Team’s report of 3 large slab avalanches observed from Highway 2. FAC Forecaster Cam observed a D2.5 hard slab avalanche on a northwest aspect of Great Northern. Outside of our forecast region, Rob, FAC Forecaster, viewed several large slab avalanches on the west, southwest, and south aspects of the Swan Crest.  These slides likely failed in the late afternoon yesterday. 
Natural and triggered avalanches involving wet surface snow are very likely on both sunny and shady slopes. We expect widespread wet loose activity today. Additionally, this heat wave will weaken ridgeline cornices and increase the likelihood of them unexpectedly breaking and subsequently triggering large to very large avalanches on the slopes below.  Planning an early exit and choosing low-angle terrain are ways to manage your risk in the face of uncertainty. If you observe avalanche activity, let us know what you are seeing by submitting an observation. "
2,Rob Millspaugh,2024-03-15,Flathead Range & Glacier NP,"[{'problem_type': ' Persistent Slab', 'problem_number': 1, 'likelihood': 'possible', 'size': ['Large (D2)', '', 'Very Large (D3)'], 'aspect_elevation': {'upper': ['north', 'northeast', 'east', 'southeast', 'northwest'], 'middle': ['north', 'northeast', 'east', 'southeast', 'northwest'], 'lower': []}, 'discussion': ""Warming temperatures will stress buried weak layers and could result in very large avalanches that break 2-4 feet below the surface. Several faceted crusts have been documented on NW-N-SE aspects above 5000'.\xa0 These layers are not always reactive in stability tests and can give the impression of being benign or stable. The deepest layers consist of rounding facets near a stout crust formed in early February. During a wind-loading event two weeks ago, this layer produced a cycle of very large avalanches in the Flathead Range. Give steep, shaded slopes a wide margin.\xa0 Recognize that small surface slides or cornice falls have the potential to trigger more destructive avalanches on buried weak layers.\xa0""}, {'problem_type': ' Cornice Fall', 'problem_number': 3, 'likelihood': 'possible', 'size': ['Small (D1)', '', 'Large (D2)'], 'aspect_elevation': {'upper': ['north', 'northeast', 'east', 'southeast', 'northwest'], 'middle': ['north', 'northeast', 'east', 'southeast', 'northwest'], 'lower': []}, 'discussion': ""Since mid-February, prevailing southwesterly winds have built large, overhanging cornices on slopes facing NW-N-E-SE. These giants will weaken during today's sun and warmth and can fail naturally or when approached by a rider. They often break much further back than you would expect. Whether you're on it or below it, a tumbling chuck of cornice is enough to ruin your day.\xa0 Cornice fall can also trigger large and destructive avalanches on buried weak layers, as described above in the Persistent Slab problem. Do not linger on or under slopes with cornice looming overhead. Give them a wide berth as you navigate ridgelines.\xa0""}, {'problem_type': ' Wet Loose', 'problem_number': 2, 'likelihood': 'likely', 'size': ['Small (D1)', '', 'Large (D2)', '', 'Very Large (D3)'], 'aspect_elevation': {'upper': ['east', 'southeast', 'south', 'southwest', 'west', 'northwest'], 'middle': ['east', 'southeast', 'south', 'southwest', 'west', 'northwest'], 'lower': ['east', 'southeast', 'south', 'southwest', 'west', 'northwest']}, 'discussion': 'Today starts a bit warmer and is expected to be clearer than yesterday.\xa0 A series of crusts may delay the onset or limit the extent of wet loose activity on solar aspects. Slopes sheltered from the sun may still have 4-12 inches of dry snow that will rapidly transition to wet. Rollerballs and snow falling from the trees are early signs of impending wet loose activity.  Small point releases can entrain significant amounts of snow and travel further than expected, especially when sliding on one of several crusts in the snowpack. While slow-moving, an avalanche of this nature will be hard to escape and could easily push you over cliffs or into trees. Limit your risk by choosing slopes that are more shaded and/or less steep, free from overhead hazards.'}]",Danger will rise today due to rapid warming and intense sunshine. Large avalanches may occur naturally and run long distances. Move off of and out from under steep slopes during the heat of the day. ,"Yesterday's wet loose action was more fizzle than sizzle. Today should bring on the heat in earnest, though crusts from previous warming could still limit the extent of today’s activity. Our last prolonged warming occurred late January into early February and resulted in a widespread avalanche cycle on a buried weak layer. Very large hard slabs failed early during the warming, followed by a cycle of wet slabs. That same event yielded the stout 2/3 crust.
Since then, a layer of facets near the 2/3 crust has produced sporadic action in our advisory area and beyond. It has also caused fatalities North, West, and South of our region. As we enter a period of prolonged warming, the stage is set for increased activity on buried weak layers, in addition to typical springtime problems like wet loose and cornice fall.
Avalanche Canada is painted red today, and all zones are expected to reach HIGH avalanche danger this weekend. Large human-triggered avalanches occurred near Fernie this week. Areas North have received more snow recently, and buried weak layers have been generally more reactive from the onset. Still, the slew of accidents and fatalities across the northwest US and Canada are a good reason to default to conservative terrain choices. Today, make it less about riding big terrain and more about laying in that base tan."
3,Guy Zoellner,2024-03-14,Flathead Range & Glacier NP,"[{'problem_type': ' Persistent Slab', 'problem_number': 2, 'likelihood': 'possible', 'size': ['Large (D2)', '', 'Very Large (D3)'], 'aspect_elevation': {'upper': ['north', 'northeast', 'east', 'southeast', 'northwest'], 'middle': ['north', 'northeast', 'east', 'southeast', 'northwest'], 'lower': []}, 'discussion': 'NW-N-SE aspects above 6,000’ still harbor a weak layer of facets above a crust.\xa0 This combo is identifiable by digging down 2-4 feet until you find a thick and supportable crust. It is not always reactive in stability tests and can give the impression of being benign or stable.\xa0 It is, however, a low-frequency/high-consequence scenario. Natural and human-triggered avalanches have been reported on this layer within the last week. A common theme is that every time this weak layer is tested by a dramatic change to the snowpack (i.e. warming or loading), it has produced D2-D3 avalanches. Shallow, rocky, or convex parts of the slope are places to avoid.\xa0 Enjoy good snow on more gentle terrain or ribs between bigger slopes. Cornices have developed over the last several weeks. Any of these monsters that warm, sag and fall onto the slope below could be a likely trigger for a hard slab avalanche.\xa0 Move quickly out of paths that have large cornices looming above them.'}, {'problem_type': ' Wet Loose', 'problem_number': 1, 'likelihood': 'likely', 'size': ['Small (D1)', '', 'Large (D2)'], 'aspect_elevation': {'upper': ['southeast', 'south', 'southwest', 'west'], 'middle': ['southeast', 'south', 'southwest', 'west'], 'lower': ['southeast', 'south', 'southwest', 'west']}, 'discussion': 'What skied well yesterday (Wednesday) will become a problem today. The 4-12 inches of dry snow that rests above a crust on W-S-SE aspects will become wet and slide as the sun warms the snow surface. Steep slopes that are directly exposed to the sun will be the first to manifest this problem. Rollerballs or snow falling out of the trees are your first clue that the surface snow is changing. Small point releases can entrain large amounts of snow and travel further than you expect, especially when sliding on one of several crusts in the snowpack. While slow-moving, an avalanche of this nature will be hard to escape and could easily push you over cliffs or into trees. Limit your risk by choosing slopes that are more shaded and/or less steep.'}]",Warm temperatures and direct sun will create dangerous avalanche conditions today. Rollerballs and snow falling out of trees are your clue that a wet loose avalanche cycle is starting. You can still trigger large avalanches on shaded slopes. Ridgelines and gentle terrain will provide the safest conditions and best opportunities for stunning views today.,"It’s all about trade-offs. Just when the forecast area seemed to be filled in and skiing/riding great, the clouds part and give way to warming temperatures and changing problems. 
The tricky part about the next few days is going to be managing wet snow and the lingering danger of persistent weak layers. As the snow on the sunny slopes transitions to wet, you will be forced onto more polar aspects. This shaded terrain still harbors several faceted crusts. Hard slabs failing on persistent weak layers have been well documented in the Whitefish Range and the Flathead Range over the last few weeks. We haven’t received any reports of natural or triggered avalanches in the Swan Range on these layers. Tuesday, an avalanche that failed on a buried weak layer, likely formed in early February, claimed the life of a backcountry skier near Lost Trail Pass south of Missoula.
With the sunset of the winter season just around the corner, we will have to hunt out the last powder stashes. As these get more affected by the warm weather, we’ll be driven to the precise slopes that harbor the recipe for large avalanches. Keep this in mind as FOMO begins to influence our decision-making.
As we transition into springtime travel, recall the cast of spring problems. Cornices that have grown over the last several weeks will begin to weaken due to sun and warm temperatures.  Limit your time underneath these hazards and stay well back from the edge while on ridgelines."
4,Jeff Metsky,2024-03-13,Flathead Range & Glacier NP,"[{'problem_type': ' Persistent Slab', 'problem_number': 1, 'likelihood': 'possible', 'size': ['Large (D2)', '', 'Very Large (D3)'], 'aspect_elevation': {'upper': ['north', 'northeast', 'east', 'southeast', 'northwest'], 'middle': ['north', 'northeast', 'east', 'southeast', 'northwest'], 'lower': []}, 'discussion': ""It is easy to fall into a sense of complacency with a Persistent Slab problem. Although we haven’t seen a natural persistent slab avalanche cycle recently, it is important to maintain conservative terrain choices, even when the instability appears unreactive. The potential to trigger a large to very large avalanche is possible if you find a thinner part of the slab on top of the February 3rd crust/facet combo. Signs of instability are inconsistent, creating a problem that may be difficult to manage. You may or may not see recent avalanches during your travels, or cracking/collapsing before triggering a slope. In addition, it could be the 1st, 2nd, or 10th person on the slope that triggers an avalanche that fails on the buried weak layer.\xa0 The February 3 crust/facet combo is buried 2 to 4 feet below the snow surface. Another facet/crust exist about 1 foot below the surface and was the culprit for a few human-triggered avalanches last week.\xa0 The safest way to manage this Persistent Slab problem is to choose slopes with lower slope angles and ones that aren't in the runout of large avalanche paths.\xa0""}, {'problem_type': ' Wind Slab', 'problem_number': 2, 'likelihood': 'possible', 'size': ['Small (D1)', '', 'Large (D2)'], 'aspect_elevation': {'upper': ['north', 'northeast', 'east', 'southeast', 'northwest'], 'middle': ['north', 'northeast', 'east', 'southeast', 'northwest'], 'lower': []}, 'discussion': 'Southwesterly winds have been strong enough to drift snow into thin slabs near and below ridgelines at mid and upper elevations on NW-N-E-SE aspects. Though shallow, these slabs could be reactive as they will have formed over a variety of weak surfaces. Signs of Wind Slabs include textured surfaces or hollow-sounding snow under your board or snowmachine. Look to identify and avoid terrain features where wind slabs may form. Examples include steep slopes (>35 degrees) with overhanging cornices, deposition zones with convex rollovers, and smooth wind pillows. These slabs may be small but have the potential to knock you off your feet and send you downslope into more consequential terrain. The worst-case scenario would be for a small wind slab to step down to a Very Large and dangerous Persistent Slab.\xa0'}]","Recent snow and strong winds thickened slabs above weak layers that caused very large natural avalanches last week. You may not get feedback like cracking or collapsing before triggering a destructive avalanche. Today, sticking to slopes 30 degrees or less will help to minimize your risk.","Yesterday, (Tuesday) freezing levels reached roughly 6000 feet. Cooler temps overnight should keep the wet snow problem off the list for one more day. Recent wind speeds were strong enough to transport new and recent snow across the forecast area.  
You may not see signs of instability or recent avalanches but still trigger a potentially destructive avalanche. Conditions become more complex as you climb in elevation. If you choose to travel on NW-N-E-SE aspects, consider the overlapping problems at mid and upper elevations. These are the places where conservative terrain choices: (ex. <35 degrees, deep snowpack, planar slopes) will help you make it home to ride another day.
Digging a snowpit or probing the snow to identify weak layers below you are helpful, but realize this is only one data point on a slope, and your results can be different only a few feet away. How these buried layers will react to the weight of a rider or machine is difficult to predict. Yesterday, (Tuesday) Guy and I visited the site of a human-triggered avalanche in the Southern Whitefish Range (obs). The rider triggered a large avalanche (D2.5) on the February 3 crust. Judging by a set of tracks near the crown, it appeared that the rider hit a thin part of the slab, which likely triggered the avalanche. Fortunately, no one was caught or carried in this avalanche.  Identifying thin spots on a slope is nearly impossible at times. 
As we move into a period of drier and warmer temperatures over the next couple of days, the potential for wet snow avalanches will increase at all elevations. Shallow wet loose avalanches may run quickly and farther than you expect on top of recently formed crusts. Consider adjusting travel times as activity will increase in the afternoon hours. "
