,author,date,zone,problems,bottom_line,discussion
21,Mark Dundas,2024-02-25,Flathead Range & Glacier NP,"[{'problem_type': ' Persistent Slab', 'problem_number': 2, 'likelihood': 'likely', 'size': ['Small (D1)', '', 'Large (D2)', ''], 'aspect_elevation': {'upper': ['north', 'northeast', 'east', 'southeast', 'northwest'], 'middle': [], 'lower': []}, 'discussion': 'The incoming storm will add weight and stress to weak layers buried 1 to 2 feet below the surface. These layers are found above the very hard, early February ice and crust layer. This weak snow is better developed on shady, upper-elevation slopes but is also found on isolated sunny and mid-elevation slopes.\xa0 Recent mild temperatures have initiated the strengthening of the weak layer, but this process is notoriously slow. You may not experience any signs of instability like collapsing or cracking before triggering a slide.\xa0 Choose terrain free of convexities to increase your safety margin. Steer around thin areas, such as those scoured or peppered with rocks, in favor of a deeper, more consistent snowpack. Cracking beneath your boards or machine indicates an unstable slab directing you to lower-angle terrain.\xa0'}, {'problem_type': ' Storm Slab', 'problem_number': 1, 'likelihood': 'very likely', 'size': ['Small (D1)', '', 'Large (D2)', ''], 'aspect_elevation': {'upper': ['north', 'northeast', 'east', 'southeast', 'south', 'southwest', 'west', 'northwest'], 'middle': ['north', 'northeast', 'east', 'southeast', 'south', 'southwest', 'west', 'northwest'], 'lower': []}, 'discussion': ""Strong westerly winds will transport today's snowfall into fresh slabs downwind of ridgelines, saddles, and on sidewalls of cross-loaded gullies. These slabs will increase in size and thickness as you gain elevation and the day progresses. Drifts, dunes, and rippled snow surfaces confirm that the wind has been working. Today's blowing snow will be an obvious sign that slabs are forming. As snow totals increase, storm slabs may develop in locations sheltered from the wind. These will be thinner but may become more widespread than the above-mentioned wind slabs. They can be identified by cracking at the surface in consolidated, dense snow.\xa0 Whether you are in sheltered or wind-affected terrain, cracking beneath your machine or boards indicates instability, directing you to lower-angle slopes free of overhead hazards.\xa0 Triggering a small surface slab may initiate a much larger avalanche on a buried weak layer described in our persistent slab problem below. \xa0 \xa0""}]","Today's incoming storm will develop dangerous avalanche conditions in areas favored by snowfall and wind. Expect the danger to rise as snow totals increase throughout the day and overnight. Fresh slabs will form initially on wind-drifted slopes and in sheltered locations later in the day. Cracking beneath your boards or machine directs you to seek out lower-angle terrain.
The danger may not reach HIGH until sundown or overnight.","A robust Pacific storm system will move into the area today (Sunday), with heavy snow and blustery winds creating dangerous avalanche conditions. Snowfall and windy conditions will continue overnight and into Monday, with a Winter Storm Warning in effect from noon Sunday until 0800 Monday. 
Snowfall yesterday and overnight favored the Flathead Range and John F. Stevens Canyon areas, with 5-7 inches. Most other locations were skunked.
Today's rising danger is related to the incoming snowfall. This morning, most Swan and Whitefish Range slopes will have a generally stable snowpack. The danger will increase after several inches of new snow accumulates. The danger in the Flathead Range and southern Glacier Park is slightly elevated due to recent snow, and the danger will rise sooner in this zone.
Today's storm will favor the Flathead Range, southern Glacier Park, and interior Glacier. The avalanche danger may reach HIGH later today or overnight in these locations. Forecasted totals for other areas are less. The northern Whitefish Range will receive more than the slopes near the WMR ski area.  The Swan Range may only receive totals similar to the southern Whitefish Range. We anticipate the danger reaching CONSIDERABLE in these locations. 
Monitor changing conditions and snow totals throughout the day. With the impressive wind speeds, higher quality riding will be found in terrain sheltered from the wind. 
 
 "
22,Mark Dundas,2024-02-24,Flathead Range & Glacier NP,"[{'problem_type': ' Persistent Slab', 'problem_number': 1, 'likelihood': 'possible', 'size': ['Small (D1)', '', 'Large (D2)', ''], 'aspect_elevation': {'upper': ['north', 'northeast', 'east', 'southeast', 'northwest'], 'middle': [], 'lower': []}, 'discussion': 'It is still possible to trigger\xa0a\xa0slab that breaks 1 to 2 feet deep on thin layers\xa0of weak snow above the very hard, early February ice and crust layer. These\xa0layers\xa0are better developed on shady, upper-elevation slopes but are also found on isolated sunny and mid-elevation slopes.\xa0 Recent mild temperatures are helping to strengthen the weak layer, but this process is notoriously slow. You may not experience any signs of instability like collapsing or cracking before triggering a slide.\xa0 Choose terrain free of convexities to increase your safety margin. Steer around thin areas, such as those scoured or peppered with rocks, in favor of a deeper, more consistent snowpack. Cracking beneath your boards or machine indicates an unstable slab directing you to lower-angle terrain.\xa0'}, {'problem_type': ' Wind Slab', 'problem_number': 2, 'likelihood': 'possible', 'size': ['Small (D1)', '', 'Large (D2)'], 'aspect_elevation': {'upper': ['north', 'northeast', 'east', 'southeast', 'northwest'], 'middle': ['north', 'northeast', 'east', 'southeast', 'northwest'], 'lower': []}, 'discussion': 'West and southwesterly winds developed Friday, increased overnight, and will remain elevated today (Saturday). In most windward locations, only several inches of snow are available for transport, which will limit drifting. However, expect to find thin, fresh slabs reactive to the weight of a rider downwind of ridgelines, saddles, and on sidewalls of cross-loaded gullies. These slabs will increase in size and thickness as you gain elevation. Drifts, dunes, and rippled snow surfaces confirm that the wind has been working. Blowing snow and cornices point in the direction of slab formation. Cracking beneath your machine or boards indicates instability, directing you to safer, sheltered terrain.\xa0 Wind slabs will form on the same slopes that harbor our persistent slab problem. Triggering a small wind-drifted feature may initiate a much larger avalanche.\xa0 \xa0 \xa0'}]","Triggering a large avalanche remains a possibility—primarily in wind-affected terrain. In these areas, a slab may exist atop a buried weak layer. To reduce your risk, avoid slopes with evidence of wind, such as fresh drifts or a stiffer snow surface that supports your sled or skis.
A strong storm will impact the area beginning Sunday, creating dangerous avalanche conditions. ","A robust Pacific storm system will move into the area on Sunday, with heavy snow and blustery winds creating dangerous avalanche conditions. If the forecast verifies, we may reach CONSIDERABLE danger on Sunday and perhaps HIGH on Monday. Unsettled weather continues throughout the work week, keeping the hazard elevated and new snow avalanche problems on the list. 
Today (Saturday), we will primarily experience the effects of wind, with the chance of light snow showers developing this afternoon. Due to moderate sustained west and southwest winds, we added wind slab to the problem list. Overnight wind speeds were impressive, with gale force gusts (greater than 38 mph) at many upper elevation stations, with 88 mph recorded at Tunnel Ridge. Despite the limited snow available for transport, riders noted wind-drifted snow filling in their skin track along with small reactive cornices in southern Glacier Park.
The last recorded avalanche on a buried weak layer occurred on Monday, 5 days ago. This week's relatively mild temperatures are helping to strengthen this layer found 1 to 2 feet below the surface. Today's wind loading will initially test this weak snow, but the heart punch begins tomorrow with the heavy snow and drifting.  
In the southern Whitefish Range, three groups from the Patrol Fund Level 2 avalanche course submitted observations from just east and west of the ski area (Observation 1, Observation 2, Observation 3). Numerous snowpit tests resulted in non-propagating results except for an ECTP 28 down 37 cm on a south aspect. They looked but could not locate the buried surface hoar (photo) that Rob noted Thursday. 
Friends Fest is Here! Today, February 24th, is the last day—Hot Dog Days at the Canyon Creek trailhead and the top of Flower Point chair at WMR. Don't miss the Ultimate Après with Backcountry Partner Speed Dating and the Big A$$ Raffle. More info at flatheadavalanche.org/event/friendsfest"
23,Rob Millspaugh,2024-02-23,Flathead Range & Glacier NP,"[{'problem_type': ' Persistent Slab', 'problem_number': 1, 'likelihood': 'possible', 'size': ['Small (D1)', '', 'Large (D2)', ''], 'aspect_elevation': {'upper': ['north', 'northeast', 'east', 'southeast', 'northwest'], 'middle': [], 'lower': []}, 'discussion': 'Triggering a slab that breaks on a weak layer one to two feet deep remains a hazard. The weak layer consists of faceted snow and sometimes surface hoar a few inches above a very hard crust or ice layer formed in early February. This layer is not distinct on some slopes, though the crust and ice are apparent. The hazard exists primarily at upper elevations on steep, shaded slopes, and resulted in two recent accidents and two near misses. You can find this hazard on isolated slopes elsewhere, including middle elevations and solar aspects. Reduce your risk through careful terrain selection during your climb, traverse, or descent. Evaluate slope angles, slope shapes, potential trigger points, and the consequences of a slide.\xa0 Good options include slopes that are less than 35 degrees in steepness, concave (bowl-shaped) or planar in shape, and not peppered with rocks and trees or punctuated by cliff bands, gullies, or abrupt benches.\xa0'}]","On upper-elevation, shaded slopes, you can trigger slabs that break one to two feet deep without obvious signs of instability. Decrease your risk by choosing terrain with a consistent slope angle and free from hazards like cliffs, gullies, and exposed rocks and trees. Travel one at a time and watch your partner from a safe location.","Once bitten, twice shy: that’s my attitude toward the current persistent slab problem. With two accidents and two near misses in the last week, I feel a bit shier than I usually might at Moderate danger. 
Besides these incidents, the weak structure has not given obvious signs of instability, like cracking or collapsing. Furthermore, this structure has been challenging to identify in pit profiles and tests, although more recent observations are finding propagation in ECTs. The weak layer presents as a layer of rounding facets and patchy surface hoar 1-2 feet below the surface and a few inches above the stout and well-documented crust from early February. In some cases, it is barely softer than the overlying slab. It has fooled experienced parties, including FAC forecasters.
During my brief tour outside of WMR yesterday (Thursday), I had the luxury of finding an obvious layer of buried surface hoar roughly one foot deep, which propagated with moderate force. This prominent layer appears to be the exception and not the norm. Elsewhere, I'm placing less emphasis on my interpretation of the snowpack and more on spatial variability and uncertainty. The recent incidents and close calls are good reasons to reevaluate and consider increasing your margins by dialing back to less aggressive terrain. 
With minimal new snow, we've elected to drop the wind slab problem. Winds at Aeneas Ridge in the Swan Range, Hornet in the Whitefish Range, and along the continental divide have remained adequate for transport and may increase throughout the day. If you are in one of these areas and notice the hallmarks of wind-effected snow, like a scalloped surface or dune-shaped features, consider moving to less steep or more sheltered terrain. Warm temperatures and sunshine in today's forecast mean there is potential for some small wet loose activity; however, this again will be limited by scant snow on crusty solar aspects. Pay attention to the weather and the snow surface throughout the day. If you're on a southerly slope with more than 8 inches of loose snow transitioning to wet, it's probably time to find less steep or less sunny terrain.
Friends Fest is Here! February 21st-24th: Check out Workshop Night (Tonight) with State of the Snowpack and USGS, Hot Dog Days, Ultimate Après with Backcountry Partner Speed Dating, and the Big A$$ Raffle. More info at flatheadavalanche.org/event/friendsfest
 "
24,blase reardon,2024-02-22,Flathead Range & Glacier NP,"[{'problem_type': ' Persistent Slab', 'problem_number': 1, 'likelihood': 'possible', 'size': ['Small (D1)', '', 'Large (D2)', ''], 'aspect_elevation': {'upper': ['north', 'northeast', 'east', 'southeast', 'northwest'], 'middle': [], 'lower': []}, 'discussion': ""Triggering a slab that breaks one to two feet deep remains a lingering and serious hazard on steep, upper-elevation, shaded slopes. It's an isolated hazard elsewhere. The slabs sit on a layer of weak, faceted snow and sometimes surface hoar a few inches above a very hard crust or ice layer. The weak layer is not that distinct on some slopes, though the crust and ice are obvious. The most reliable way of reducing your exposure to this hazard is to be very picky about the terrain you climb, traverse, or descend. Evaluate slope angles, slope shapes, and runouts. Your risk is lowest on slopes that are less than 35 degrees that are concave (bowl-shaped) or planar, and aren't above trees, rocks, benches, or gullies.\xa0""}, {'problem_type': ' Wind Slab', 'problem_number': 2, 'likelihood': 'possible', 'size': ['Small (D1)', ''], 'aspect_elevation': {'upper': ['north', 'northeast', 'east', 'northwest'], 'middle': [], 'lower': []}, 'discussion': 'In upper-elevation terrain that collects wind-blown snow, you can trigger small slabs that can be dangerous if they carry you into a gully, trees, or rocks, or over a cliff. That includes the lee sides of ridges and chutes, slopes below cornices, and slopes downwind of saddles. Most of these slabs have formed over the past two days; the slabs could continue developing in areas that receive more than a few inches of snow today. Before climbing or descending this terrain, look for signs of wind-affected snow at the surface - smooth, pillowy drifts or dunes? Check the runout of the slope - free of things that can magnify the consequences of getting caught and carried down?\xa0 If the answer to either question is yes, step back and consider alternatives on wind-sheltered, low-angle slopes.'}]","The best riding with the lowest risk of triggering a slab avalanche exists on shaded, mid-elevation slopes. In this terrain, stick to slopes less than 35 degrees that have runouts free of terrain traps. Elsewhere, a sun crust may make for less quality riding. And on upper-elevation, shaded slopes, you can trigger slabs that break one to two feet deep with little prior signs of instability.","An innocuous-looking layer of facets and surface hoar continues to pose a danger across the region. It's been the weak layer in at least two accidents - one mine - and two near-misses in the past week. 
While this structure exists across the region, we can narrow down the terrain where you're most likely to get into trouble, based on accident sites and recent observations. The most likely suspects:

Face north to northeast at upper elevations
Are in the Flathead Range
Are more than 35 degrees in steepness and aren't adjacent to steeper slopes
Are convex in profile

Again, that's the most likely terrain. One unintentionally-triggered slide occurred on a north-northwest facing slope, and another was triggered from a spot that was 33 or 34 degrees. People have reported the structure on mid-elevation slopes in all ranges, where it's propagated in snowpack tests. During the storms that loaded the weak layer, remotely-triggered slides broke on this layer in the Swan Range. A few naturals have also released on southeast-facing slopes. Several of the unintentionally-triggered slides also appear to have released where the slab was thinner, possibly because winds scoured away some of the slab.
I'm focusing on these characteristics because terrain-based decisions are the most reliable way of avoiding surprises and trouble. The slab above the facets and surface hoar is relatively soft and the weak layer is spatially variable. In those conditions, snowpack tests tend to be less accurate predictors of instability. And none of the parties involved in the past week's incidents reported collapsing or cracking prior to the slides. 
A secondary, short-lived hazard today is triggering small wind slabs. These aren't widespread, and most are shallow and small. And they're definitely more predictable. Nonetheless, they can be dangerous in steep, consequential terrain, like couloirs and chutes and steep faces. Check for this hazard with thorough assessments before committing to steep, consequential terrain. "
25,Guy Zoellner,2024-02-21,Flathead Range & Glacier NP,"[{'problem_type': ' Persistent Slab', 'problem_number': 1, 'likelihood': 'possible', 'size': ['Small (D1)', '', 'Large (D2)'], 'aspect_elevation': {'upper': ['north', 'northeast', 'east', 'southeast', 'northwest'], 'middle': [], 'lower': []}, 'discussion': 'A weak layer of facets has been the culprit in a series of accidents and near-misses the past four days. This layer is buried 12 to 24 inches deep, and sits 1 to 6 inches above a very hard crust. Moderate temperatures are helping this weak layer to sinter and gain strength. The rate will vary by slope, so you may find the structure present and unreactive in stability tests at one site, yet move several yards away and get a completely different result. This layer remained sensitive to the weight of a rider two days ago (Monday) in the Flathead Range.\xa0 Give steep shaded slopes above 6,500 feet plenty of room today. Choose slopes with runouts clear of trees and gullies. If you find yourself feeling the snow getting warmer and stiffening this afternoon, dial back your terrain selection and retreat to lower slope angles.\xa0'}, {'problem_type': ' Wind Slab', 'problem_number': 2, 'likelihood': 'possible', 'size': ['Small (D1)', ''], 'aspect_elevation': {'upper': ['north', 'northeast', 'east', 'northwest'], 'middle': [], 'lower': []}, 'discussion': 'Fresh snow and overnight winds have drifted snow near ridgelines.\xa0 Thin windslabs may sit atop several feet of old snow that has buried a weak layer.\xa0 If these break they can propagate much further across the slope than you expect.\xa0 Manage this by keeping to slopes that are planar and runouts that are clear of terrain traps. '}]","Avalanches may still fail at a weak layer buried a few inches above a very hard crust. Overnight winds and a few inches of snow have formed thin pockets of wind drifted snow below ridgelines. Low angle slopes that are protected from the wind will be the most enjoyable today.  
 ","Patience is the name of the game with today’s problems.  A Persistent Slab avalanche  structure exists across the forecast region. The primary concern is a layer of weak, faceted snow buried 12 to 24 inches below the surface and a few inches above the early February crust/ ice layer. The layer appears most developed in the Flathead Range, where slabs have been  reactive to the weight of skiers multiple times over the last 4 days (here and here). Several of these slides have been triggered from spots where the slab is thinner. The same facet and crust combo has been reported in the Whitefish and Swan Ranges. However, we’re not getting any reports of triggered avalanches in these 2 ranges. In the Flathead Range incidents, the parties observed no collapsing or cracking prior to triggering the slides. The take home message is that this weak layer may provide very little feedback, until it is breaking underneath you or your machine.  
Temperatures hovering around freezing and cloudy skies this morning mean conditions ought to be ripe for traveling on your favorite ridgeline today or riding from one drainage to the next.  If the sun does break through, or if the temperature exceeds the forecast, beware of loose snow avalanches.  Clues will be rollerballs and sticky skins. The Flathead Range has seen most south aspects get cooked lately. The Northern Whitefish and Swan ranges still harbor soft snow that hasn't been affected by the sun. This slight warming could also speed settlement and consolidation of the slab above the facets. Find small test slopes and terrain free of hazards below before commiting to a line if you feel this happening.  We have yet to see the facet/crust combo in the Whitefish and Swan Ranges tested like in the Flathead Range. 
 "
26,Cam Johnson,2024-02-20,Flathead Range & Glacier NP,"[{'problem_type': ' Persistent Slab', 'problem_number': 1, 'likelihood': 'possible', 'size': ['Small (D1)', '', 'Large (D2)', ''], 'aspect_elevation': {'upper': ['north', 'northeast', 'east', 'southeast', 'northwest'], 'middle': [], 'lower': []}, 'discussion': 'Recent avalanches are a glaring red flag. In the past three days, there have been two accidents and two near-misses, all in the Flathead Range. Additionally, south of the advisory area near Seeley Lake, a rider triggered a large avalanche failing on this same layer. We’ve received no reports of triggered avalanches in the Whitefish Range, though we aren’t ruling the problem out in that zone. Signs of whumpfing, collapsing, and shooting cracks are all signs of instability but are not common with this weak layer. Avalanches are breaking 1 to 2 feet deep, on weak facets a few inches above a hard crust. The best tactic is avoidance. Slopes that face north and east are proving most sensitive. Avalanches have failed on slopes with angles in the low 30-degree range.'}, {'problem_type': ' Wind Slab', 'problem_number': 2, 'likelihood': 'possible', 'size': ['Small (D1)', ''], 'aspect_elevation': {'upper': ['north', 'northeast', 'east', 'southeast', 'northwest'], 'middle': ['north', 'northeast', 'east', 'southeast', 'northwest'], 'lower': []}, 'discussion': 'Winds will drift new snow into fresh slabs sensitive to the weight of the rider. Slabs of drifted snow should be small unless snow accumulations exceed forecast totals. Pay attention to the amount of freshly fallen snow and signs of instability. Cracking around your boards or machine is a sign of an unstable slab.\xa0 Slabs of wind-drifted snow are adding weight to a poor snowpack structure. A small avalanche may easily step down to a weak layer buried 1 to 2 feet below the surface. If this occurs, slabs will break wider than you may expect and be difficult to escape.'}]",Large human-triggered avalanches occurred within the last 24 hours. Stick to lower angled slopes on shaded aspects above 6500 feet. New snow and southwest winds will form thin slabs of drifted snow. Windward aspects are safer options for riding. ,"Today, southwest winds will drift the couple of inches of new snow that falls. Expect thin and small slabs to form on leeward-facing aspects. A sun crust will limit the amount of snow available for transport, so drifting should be fairly minimal. The aspects being drifted are the same aspects where people have triggered large avalanches failing on a persistent weak layer 1 to 2 feet below the surface.
Reported human-triggered avalanches are confined to shaded aspects above 6500 feet in the Flathead Range. I suggest dialing slope angles back wherever you feel a hard crust buried more than a foot below the surface. Signs of instability and snowpack tests are not providing negative feedback, which may dupe a person into thinking the slope is stable. Here is an example.
Yesterday, Blase and I visited the crown of a recent human-triggered avalanche. This avalanche failed on facets a few inches above the early February crust. During our descent, we unintentionally triggered a neighboring slope. The start of this slope had a planar/concave shape with slope angles in the low 30s. The slope was relatively short and sparsely vegetated. Prior to the slide, we observed no signs of unstable snow on neighboring slopes and no alarming results in tests. The one red flag was the nearby avalanche.  The first rider on the slope triggered the slide just below the ridgeline and could not escape the moving debris. The rider was caught, carried, and lost some equipment. 
Experienced teams and veteran forecasters are getting surprised. This is not a problem to try to outsmart. Keep it simple. 
Upcoming event: Flathead Avalanche Friends Fest, February 21-24. We have four days of events on tap for you: Beacons & Brews, Name That Tune/Name That Avalanche, Workshop Night with State of the Snowpack and USGS, Hot Dog Days, and the Ultimate Après with Backcountry Partner Speed Dating and the Big A$$ Raffle. More info at flatheadavalanche.org/event/friendsfest"
