,author,date,zone,problems,bottom_line,discussion
32,Cam Johnson,2024-02-14,Flathead Range & Glacier NP,"[{'problem_type': ' Storm Slab', 'problem_number': 1, 'likelihood': 'likely', 'size': ['Small (D1)', '', 'Large (D2)'], 'aspect_elevation': {'upper': ['north', 'northeast', 'east', 'southeast', 'south', 'southwest', 'west', 'northwest'], 'middle': ['north', 'northeast', 'east', 'southeast', 'south', 'southwest', 'west', 'northwest'], 'lower': []}, 'discussion': '1 to 3 feet of recent snow rests above soft, weak snow. Natural avalanches and remotely-triggered avalanches were reported above 6500 feet on north-east-southeast facing aspects. Shooting cracks and whumpfing collapses have also occurred recently. This is bullseye information for us to utilize today. Whumpfing collapses, shooting cracks, and recent avalanches are all signs of unstable snow. Today, expect to observe these warning signals more commonly on shaded aspects where slabs rest over weak layers. Slabs can be triggered from a distance and propagate surprisingly far distances. Keep an eye out for wind-drifted snow in atypical locations. Look for dune-shaped drifts and wind-textured surfaces. Although remote weather stations reported light wind speeds, easterly winds are notorious for drifting snow where they gain momentum as they channel through terrain features.'}]","Small to large avalanches failed on slopes above 6500 feet in the past 48 hours. Shooting cracks, recent avalanches, and audible collapses should point you to lower-angle terrain. Avalanches may be triggered from afar and wrap around terrain features. Give the snowpack time to adjust before riding in steep, consequential terrain. ","We have kept the danger rating elevated in the Swan and Flathead Ranges.  Although we suspect natural avalanche activity to be over, human-triggered avalanches may still be likely. Conditions will be more dangerous near the crests of the Flathead Range and Swan Range where more snow fell. This recent snow landed on weak layers that may be slow to gain strength. 
Recent storm totals vary throughout the forecast region. Below are Snow Water Equivalent (SWE) totals starting February 8th:
Noisy Basin in the Swan Range: 4.8 inches
Stahl in the northern Whitefish Range: 2.5 inches
Whitefish Mountain Resort in the southern Whitefish Range: 1.6 inches
Flattop in Central Glacier National Park: 2 inches *The Flathead Range, especially along the crest in the Middle Fork Corridor, likely received more precipitation.
Southwesterly winds during the storm were generally unimpressive. Blase did find wind-thickened slabs along the crest of the Swan Range on Monday. I’d suspect to find similar conditions along other exposed ridgelines. Winds flipped directions to the east yesterday. Easterly winds can wreak havoc on lower and middle-elevation slopes. Winds commonly channel through valleys, leaving some areas scoured and drifted, with other valleys untouched. Easterly winds are going to ramp up to transportable speeds this evening. If you are out late or planning an evening ride, pay close attention to wind-drifting snow. Slabs will become more sensitive to the weight of a rider.
Recent snow landed on a variety of weak surfaces that vary by aspect. Near-surface facets and surface hoar exist on shaded slopes. We suspect these will be the most sensitive and dangerous slopes at the moment. These are the same slopes that remotely triggered avalanches have failed on.
A crust/facet/crust combination exists on various solar aspects. This structure has been reported in all three ranges. It is more difficult to predict when these aspects will become active. The upper crust allows the weak layer to withstand a larger load before collapsing. This structure can produce very large avalanches IF it receives a substantial loading event.
Keep an eye on the sun and the surface snow IF temperatures become warmer than forecasted. Rollerballs, pinwheels, and point releases out of steep, rocky terrain indicate an impending Wet Loose cycle. Cold air should limit this problem today.
Upcoming event: Flathead Avalanche Friends Fest, February 21-24. We have four days of events on tap for you: Beacons & Brews, Name That Tune/Name That Avalanche, Workshop Night with State of the Snowpack and USGS, Hot Dog Days, and the Ultimate Après with Backcountry Partner Speed Dating and the Big A$$ Raffle. More info at flatheadavalanche.org/event/friendsfest"
33,Guy Zoellner,2024-02-13,Flathead Range & Glacier NP,"[{'problem_type': ' Storm Slab', 'problem_number': 1, 'likelihood': 'likely', 'size': ['Small (D1)', '', 'Large (D2)'], 'aspect_elevation': {'upper': ['north', 'northeast', 'east', 'southeast', 'south', 'southwest', 'west', 'northwest'], 'middle': ['north', 'northeast', 'east', 'southeast', 'south', 'southwest', 'west', 'northwest'], 'lower': []}, 'discussion': 'Freshly fallen and wind-drifted snow will remain sensitive to a skier or snowmachiner. Yesterday (Tuesday), remotely triggered avalanches large enough to bury and injure a person occurred in the Swan Range (observation). Winds formed harder and thicker slabs along ridgelines.\xa0 Cracking in the snow around you or whumpfing sounds are clues you’ve found unstable snow.\xa0 Retreat to lower-angle slopes if you notice these signs. Remember, all of the new snow in the last 48 hours has fallen on a faceted crust from early February.\xa0 Any slab that fails on this layer will likely extend much further than expected.\xa0 '}]",New snow and recently drifted snow have developed dangerous avalanche conditions.  Soft slabs 1-2 feet thick will be reactive to the weight of a skier or snowmachine.  Lower your risk by giving steep slopes plenty of room.  Avalanches that fail today could be larger than you anticipate.,"Skunked, kind of.  While we all were hoping to wake up this morning and find weather stations reporting another foot of snow overnight, the faucet was turned off.   24-hour snowfall totals in the Whitefish range reported 3-9 inches, the Flathead range saw 4-7 inches and Noisey Basin received 6 inches.  These numbers account for recent snowpack settlement, so storm totals are likely much greater.  The storm put down an impressive total of 2.7 inches of water at Noisy Basin and 1.7 inches at Stahl Peak. 
The problem today encapsulates many things.  Winds have thickened slabs and drifted snow along ridgelines.  Over a foot of snow has fallen in the last 48 hours in sheltered terrain.  This new snow fell on facets above a very thick crust from early February.  There is complexity today as the snowpack adjusts to the recent loading.
Confidence is high that all aspects and elevations in the forecast area were affected by unseasonably warm weather in late January.  Several inches of light snow then fell making travel difficult and sluffing snow a problem.  This problematic soft snow faceted above the crust.  Now, today, it's buried by 1 to 2 feet of recent snow.  Avalanches that fail at this interface may extend around terrain features and be triggered from further away."
34,Cam Johnson,2024-02-12,Flathead Range & Glacier NP,"[{'problem_type': ' Storm Slab', 'problem_number': 1, 'likelihood': 'likely', 'size': ['Small (D1)', '', 'Large (D2)'], 'aspect_elevation': {'upper': ['north', 'northeast', 'east', 'southeast', 'south', 'southwest', 'west', 'northwest'], 'middle': ['north', 'northeast', 'east', 'southeast', 'south', 'southwest', 'west', 'northwest'], 'lower': []}, 'discussion': 'New and recent snow will form slabs sensitive to the weight of a rider, and natural avalanches are possible. Winds will drift snow into thicker and harder slabs along ridge crests. Any triggered avalanches will become larger and more dangerous throughout the day. Pay close attention to your surroundings. Signs of recent avalanches, shooting cracks, or whumpfs should direct you toward lower-angle terrain free of overhead hazards. NOTE: New snow is landing on weak surfaces. This may cause avalanches to propagate wider distances or be triggered remotely. Today is a day to have a ""Stepping Back"" mindset.'}]",Dangerous avalanche conditions are developing at upper elevations. New snow and wind will form slabs large enough to bury and injure a person. Stick to lower angle slopes if you see 8 or more inches fall throughout the day or see signs of shooting cracks and recent avalanches. Avoid areas of wind-drifting snow and be wary of traveling in the runouts of large avalanche paths.,"Conditions are changing! As conditions change, so should our travel habits. Plan to dial back to more conservative terrain choices throughout the day. New and recent snow is piling up and landing on a weak layer of near-surface facets above a slick crust. This may cause avalanches to break wider distances and in unexpected ways.
Today’s avalanche forecast relies on today’s precipitation forecast. There is high confidence that the forecast area will receive anywhere from .5 to 1 inch of Snow Water Equivalent (SWE) by Tuesday Morning. This can translate into upwards of 1 to 2 feet of snow. Although the liquid water amounts may not be overly impressive, snowfall rates of 1 inch or more an hour can rapidly increase the avalanche danger. Forecasted snowfall rates like this make it even more important to pay close attention to changing conditions. The avalanche danger WILL rise throughout the day with continued snowfall.
Precipitation amounts vary throughout the forecast area and within each forecast region. The Swan Range will see the higher end of precipitation totals. Models show precipitation favoring terrain west of Flathead Lake, so expect the avalanche danger to increase rapidly the further south you travel. The Flathead Range should catch any spillover from the Swan Range. I’d expect to see snowfall totals of 6 to 12 inches in the Flathead Range. The crest of the range will likely wring out the remaining moisture, so expect less snow in southern and central Glacier National Park. The Northern Whitefish Range picked up close to an inch of water yesterday (Sunday) and may be favored with today's snow as well. Areas like Ten Lakes, Red Meadow Pass, and Gibraltar Ridge will see elevated avalanche danger. "
35,Sarah Williams,2024-02-11,Flathead Range & Glacier NP,"[{'problem_type': ' Wind Slab', 'problem_number': 1, 'likelihood': 'possible', 'size': ['Small (D1)', '', 'Large (D2)'], 'aspect_elevation': {'upper': ['north', 'northeast', 'east', 'southeast', 'northwest'], 'middle': ['north', 'northeast', 'east', 'southeast', 'northwest'], 'lower': []}, 'discussion': 'Saturday, observers noted increasing southwest winds, snow transport, and surface cracking in wind-affected slopes. The wind continued overnight, drifting the 8-12 inches of recent low-density surface snow. Thin, fresh slabs are forming on a layer of lower-density snow, adding to the instability. These features will be larger, thicker, and more widespread at upper elevations while only found in the most wind-prone locations at middle elevations. Look for them downwind of ridgelines and saddles and on the sidewalls of gullies.\xa0 Look for rippled surfaces, hollow-sounding stiff snow, and cracks shooting out from your boards or machine. Blowing snow and cornices point toward the direction of loading. Terrain sheltered from the wind will offer a safer and better riding experience.'}]","Recent snow and increasing southwest winds will form fresh slabs above 5000 feet. Look for blowing snow, dune-shaped drifts, or textured surface snow as visual clues. You can reduce your risk of triggering a slide by avoiding steep, rocky, wind-affected terrain. ","As of 5 AM, weather stations report an uptick in southwesterly winds that will redistribute the recent unconsolidated snow. To account for these winds, we’ve transitioned our primary avalanche problem from Storm Slab to Wind Slab. Above 6500 feet, the snow available for transport will develop larger and more widespread slabs, while middle elevations will likely have less snow and wind, making for more isolated hazards. 
We dropped our Loose Dry problem today, however keep in mind that fast-running sluffs in steep terrain can still catch you off guard.  Before committing to a steep line, consider the terrain below you and the consequences of taking a ride into places you don’t want to go.
Observers from Saturday reported 3 to 12 inches of cohesionless snow over a stout and supportable crust formed in early February. Varying depths across the region favored upper elevations, and many observations described sluff management as their primary hazard. On steep slopes, observers were challenged by sluffing and sliding on the slick crust. For one party in the northern Whitefish Range, a rider was caught and carried 75 feet, but was thankfully not buried and escaped uninjured. Other observers in the southern Whitefish Range (Example 1, Example 2, Example 3) confirmed a loose, dry problem that was straightforward to manage.
In the Skyland area, riders reported isolated cracking, wind gusts transporting snow, and warming southern aspects from solar input. This contrasted conditions in the Swan Range, where skies were mostly cloudy, and skiers and riders reported powder turns above 5200 feet. As we enter the workweek, the avalanche danger is expected to rise due to new snow overnight, with accumulations estimated to be 6 to 8 inches or more in favored locations.
Upcoming event: Flathead Avalanche Friends Fest, February 21-24. Beacons & Brews, Name That Tune/Name That Avalanche, Workshop Night, Hot Dog Days, and Ultimate Après.  Check out 4 days of events: flatheadavalanche.org/event/friendsfest"
36,Rob Millspaugh,2024-02-10,Flathead Range & Glacier NP,"[{'problem_type': ' Dry Loose', 'problem_number': 2, 'likelihood': 'likely', 'size': ['Small (D1)', '', 'Large (D2)'], 'aspect_elevation': {'upper': ['north', 'northeast', 'east', 'southeast', 'south', 'southwest', 'west', 'northwest'], 'middle': ['north', 'northeast', 'east', 'southeast', 'south', 'southwest', 'west', 'northwest'], 'lower': []}, 'discussion': 'Riders continue to trigger sluffs on steep slopes holding 4-8+ inches of unconsolidated snow above a firm crust. Sluffs will be largest in terrain protected from the sun and wind, where this week’s snowfall remains dry and incohesive.\xa0 Sunshine this morning could trigger natural sluffs on southerly slopes.\xa0 Limit your time spent in confined, long-running gullies where you’ll have difficulty escaping a sluff. Choose descent routes free of terrain traps where moving snow could rake you through exposed hazards or pile up deeply.\xa0 If the sun hangs around longer than anticipated, expect surface snow to transition and run as wet loose, particularly at middle elevations. Rollerballs are a clear sign that the wet snow is primed to slide.\xa0'}, {'problem_type': ' Storm Slab', 'problem_number': 1, 'likelihood': 'possible', 'size': ['Small (D1)', '', 'Large (D2)'], 'aspect_elevation': {'upper': ['north', 'northeast', 'east', 'southeast', 'south', 'southwest', 'west', 'northwest'], 'middle': ['north', 'northeast', 'east', 'southeast', 'south', 'southwest', 'west', 'northwest'], 'lower': []}, 'discussion': 'The Swan and Flathead Ranges recorded up to a foot of snow in the last 48 hours. This snow fell on a crust on southerly aspects and weak snow on northerlies, adding to the instability. You may find slabs both where the wind has drifted the snow and in sheltered locations. Slabs will be thicker and stiffer at upper elevations downwind of ridgelines and saddles and on the sidewalls of gullies.\xa0 Cracking beneath you or your machine indicates a sensitive slab directing you to lower-angle terrain. Utilize hand pits and small test slopes to assess how the new snow is bonding to the older snow surface.'}]","You can still trigger a slab avalanche in both sheltered and wind-affected terrain. Loose snow sluffs are likely in steep terrain and may run naturally on sunny slopes. Limit your risk by reducing the time you spend traveling above terrain traps like gullies, cliffs, or exposed rocks and trees.","As I review the weather and observations this morning, a theme emerges:  Winter is (kind of) back! Recent snowfall and seasonable temperatures have greatly improved the riding throughout the advisory area. However, in most cases, there is a prerequisite brush thrashing (obs 1, obs 2 , obs 3).
This was also the case during a FAC visit to Anna Creek on the East Side of the Swan Range. Throughout our travels, we noted generally unconsolidated snow resting on an impressively stout melt-freeze crust. We were able to kick off fast-running sluffs in extreme terrain on shaded slopes and found a cohesive slab in wind-stiffened snow at the entrance to a couloir. Both of these hazards were easily managed at the time, however, we acknowledged the potential for the faceting surface snow to become problematic once buried. Southeast aspects were particularly interesting as they harbored a crust/facet combination from warming Tuesday/Wednesday this week. Blase and Jeff noted this same structure East of WMR. This structure will be able to support a greater load and may result in larger avalanches once it reaches its limit. 
Upcoming event: Flathead Avalanche Friends Fest, February 21-24. Beacons & Brews, Name That Tune/Name That Avalanche, Workshop Night, Hot Dog Days, and Ultimate Après.  Check out 4 days of events: flatheadavalanche.org/event/friendsfest"
37,Mark Dundas,2024-02-09,Flathead Range & Glacier NP,"[{'problem_type': ' Dry Loose', 'problem_number': 2, 'likelihood': 'likely', 'size': ['Small (D1)', '', 'Large (D2)'], 'aspect_elevation': {'upper': ['north', 'northeast', 'east', 'southeast', 'south', 'southwest', 'west', 'northwest'], 'middle': ['north', 'northeast', 'east', 'southeast', 'south', 'southwest', 'west', 'northwest'], 'lower': []}, 'discussion': 'Yesterday, riders triggered sluffing on steep, northerly aspects holding 4-8 inches of weak snow. Snowfall overnight will increase the size of these slides and expand this problem onto southerly slopes, where the snow readily slides on a crust. Natural sluffing may occur on steep slopes with loose surface snow, with rider-triggered slides likely.\xa0 Utilize techniques to manage your sluff. Limit time spent in long-running gullies where getting caught in a sluff may make escape difficult. Choose descent routes free of terrain traps where the snow piles up deep.'}, {'problem_type': ' Storm Slab', 'problem_number': 1, 'likelihood': 'possible', 'size': ['Small (D1)', '', 'Large (D2)'], 'aspect_elevation': {'upper': ['north', 'northeast', 'east', 'southeast', 'south', 'southwest', 'west', 'northwest'], 'middle': ['north', 'northeast', 'east', 'southeast', 'south', 'southwest', 'west', 'northwest'], 'lower': []}, 'discussion': 'Overnight,\xa0 up to 6+ inches of snow was recorded in the Flathead Range and southern Glacier Park. Snow fell on a crust on southerly aspects and weak snow on northerlies, adding to the instability. Expect to find slabs both where the wind has drifted the snow and in sheltered locations. Slabs will be thicker and larger at upper elevations downwind of ridgelines and saddles and on the sidewalls of gullies.\xa0 Cracking beneath you or your machine indicates a sensitive slab directing you to lower-angle terrain. Utilize hand pits and small test slopes to assess how the new snow is bonding to the older snow surface.'}]","Fresh snowfall and wind have increased the avalanche danger. Riders may encounter slabs reactive to their weight in both wind-affected and sheltered areas. Expect to trigger loose snow slides on many steep slopes. Enjoy today's powder on lower-angle terrain so you can do the same tomorrow.
The hazard is highest in the Swan Range, where more snow fell.","Snowfall Thursday and overnight into Friday morning favored the Swan Range, with over 1 inch of SWE and 7+ inches at Noisy Basin. As of 0500, most other mountain locations had picked up 3-6+ inches with 0.7 inches of SWE at Stryker Ridge in the Whitefish Range. Winds shifted back to the southwest yesterday and are generally light with moderate gusts. The wind is forecast to blow from the north or northeast as a low develops east of the Divide today. Temperatures, thankfully, have fallen back to a cool, seasonable range.
The new snow and wind have bumped the avalanche danger following two days of LOW danger.  The hazard is highest in the Swan Range, where more snow accumulates, and the winds are stronger. The Flathead Range and southern Glacier Park have also done well, with the Whitefish Range lagging. Snowfall should taper off through the day, but fresh slabs will continue forming in wind-affected terrain at upper elevations.
The storm was accompanied by intense periods of precipitation. The Noisy Basin SNOTEL recorded 0.5 inches of SWE (4+ inches) in a two-hour period overnight. Snowfall rates greater than 1 inch per hour generally create instability and possible natural avalanche activity. We have rolled a storm and wind slab problem together to mitigate uncertainty. Storm slabs are problem #1 in the Swan and Flathead zones, while loose dry is the #1 problem in the Whitefish Range.
Yesterday (Thursday), Rob, Cam, and Guy explored the terrain around the Anna Creek cabin on the east side of the Swan. They reported having to manage their sluff on steep, northerly aspects where 6-8 inches of faceted, loose surface snow moved downhill easily. Blase and Jeff encountered similar conditions on their tour east of the WMR ski area. 
Upcoming event: Flathead Avalanche Friends Fest, February 21-24. Beacons & Brews, Name That Tune/Name That Avalanche, Workshop Night, Hot Dog Days, and Ultimate Après.  Check out 4 days of events: flatheadavalanche.org/event/friendsfest"
38,Mark Dundas,2024-02-08,Flathead Range & Glacier NP,[],"Recent benign weather has resulted in a generally stable snowpack. On isolated, steep, northerly slopes, you could still trigger a thin, loose slide that may knock you off your feet or encounter a small slab of wind-drifted snow reactive to your weight. Snow returns overnight into Friday with an increasing hazard. ","Due to the recent weather and snowpack conditions, we are not listing any avalanche problems today. This is unusual, especially for early February. A summary of the impact of the past few days on the snowpack is listed below.
Tuesday and Wednesday's dry, sunny weather initiated small, wet loose avalanches on solar aspects in the snowfall from earlier in the week and over the weekend (Observation 1, Observation 2). This melting formed a crust on many sunny aspects (Observation). Today's cloudy and cooler conditions will limit the crust's ability to break down and shut down any potential for wet loose slides.
On shaded slopes, thin, dry loose slides occurred naturally and were triggered by riders over the past few days (Observation 1, Observation 2). There remains a chance that you could trigger a small sluff in steep, northerly terrain. These should be easy to manage but could become a problem in technical terrain if a rider is knocked off their machine or boards. 
Shifting winds earlier in the week initially transported the new snow into thin slabs on various aspects. The winds have quieted down the past 48 hours, and we feel slabs have gained strength and are generally unreactive to triggering by a rider. Look for signs of wind-affected snow at upper elevations, such as dunes or drifts beneath ridgelines and in gullies. Cracking in this snow indicates instability, directing you to sheltered or lower-angle terrain. 
Snow will develop later today and into Friday. We expect several inches at all mountain locations, with the Swan Range favored. The avalanche danger will rise overnight, with new snow avalanche problems such as wind slabs and dry loose returning tomorrow.
Although the riding conditions are less than ideal in the Flathead, at least we are not dealing with a nasty persistent slab problem that southwest Montana and the Gallatin National Forest Avalanche Center have. The lower half of their snowpack is faceted (sugar) snow. It has been reactive to nearly every load placed onto it by small storms, resulting in a multi-day elevated avalanche hazard.
Upcoming event: Flathead Avalanche Friends Fest, February 21-24. Beacons & Brews, Name That Tune/Name That Avalanche, Workshop Night, Hot Dog Days, and Ultimate Après.  Check out 4 days of events: flatheadavalanche.org/event/friendsfest"
